{
  "$schema": "https://json-schema.org/draft/2020-12/schema",
  "$id": "https://raw.githubusercontent.com/kastwey/corro/main/sdk/Corro.PackageSdk/Schemas/truths.schema.json",
  "title": "Corro bluff deck",
  "description": "One locale's questions for a bluff package: each with the true answer that hides among the players' bluffs.",
  "type": "array",
  "minItems": 1,
  "items": {
    "type": "object",
    "required": ["id", "question", "truth"],
    "properties": {
      "id": { "type": "string", "pattern": "^[A-Za-z0-9_-]+$" },
      "question": {
        "type": "string",
        "minLength": 1,
        "description": "The question as the table reads it, with a blank (___) where the answer goes."
      },
      "truth": {
        "type": "string",
        "minLength": 1,
        "maxLength": 80,
        "description": "The true answer, as it is revealed. A bluff matching it is refused."
      },
      "alsoTrue": {
        "type": "array",
        "uniqueItems": true,
        "items": { "type": "string", "minLength": 1 },
        "description": "Other spellings or wordings of the truth, refused as bluffs like the truth itself."
      }
    },
    "additionalProperties": false
  }
}
