[
  { "id": "zanzibar-war", "question": "La guerra más corta de la historia, entre Gran Bretaña y Zanzíbar en 1896, duró unos ___.", "truth": "38 minutos", "alsoTrue": ["cuarenta minutos", "40 minutos", "treinta y ocho minutos", "menos de una hora", "media hora"] },
  { "id": "eiffel-summer", "question": "En verano, la torre Eiffel crece unos ___.", "truth": "15 centímetros", "alsoTrue": ["15 cm", "quince centímetros", "quince centimetros"] },
  { "id": "octopus-hearts", "question": "Un pulpo tiene ___ corazones.", "truth": "tres", "alsoTrue": ["3"] },
  { "id": "tomb-honey", "question": "La miel hallada en tumbas del antiguo Egipto seguía siendo ___.", "truth": "comestible", "alsoTrue": ["apta para comer", "buena para comer", "perfectamente comestible"] },
  { "id": "flamingo-group", "question": "En inglés, a un grupo de flamencos se le llama una ___.", "truth": "flamboyance", "alsoTrue": ["a flamboyance", "flamboyancia"] },
  { "id": "scotland-animal", "question": "El animal nacional de Escocia es el ___.", "truth": "unicornio", "alsoTrue": ["un unicornio"] },
  { "id": "banana-berry", "question": "Para un botánico, el plátano es una ___.", "truth": "baya", "alsoTrue": ["una baya", "bayas"] },
  { "id": "swiss-guinea-pig", "question": "En Suiza está prohibido por ley tener una sola ___.", "truth": "cobaya", "alsoTrue": ["cobayas", "una cobaya", "conejillo de indias", "un conejillo de indias"] },
  { "id": "nintendo-cards", "question": "Nintendo se fundó en 1889 para fabricar ___.", "truth": "cartas", "alsoTrue": ["naipes", "barajas", "cartas de juego", "cartas hanafuda", "hanafuda", "una baraja"] },
  { "id": "wooden-mouse", "question": "El primer ratón de ordenador estaba hecho de ___.", "truth": "madera", "alsoTrue": ["un bloque de madera", "madera de pino"] },
  { "id": "astronaut-height", "question": "En el espacio, los astronautas crecen unos ___.", "truth": "5 centímetros", "alsoTrue": ["5 cm", "cinco centímetros", "cinco centimetros"] },
  { "id": "wombat-cubes", "question": "Las cacas del wombat tienen forma de ___.", "truth": "cubo", "alsoTrue": ["cubos", "cubitos", "dado", "dados", "cuadrado", "cuadrados"] },
  { "id": "oxford-aztec", "question": "La Universidad de Oxford es más antigua que el imperio ___.", "truth": "azteca", "alsoTrue": ["de los aztecas", "el azteca"] },
  { "id": "cleopatra-moon", "question": "Cleopatra vivió más cerca en el tiempo de la llegada a la Luna que de la construcción de ___.", "truth": "la Gran Pirámide", "alsoTrue": ["las pirámides", "las piramides", "la gran pirámide de guiza", "la gran piramide de guiza", "la pirámide de keops", "la piramide de keops", "las pirámides de guiza"] },
  { "id": "sloth-breath", "question": "Un perezoso puede aguantar la respiración más tiempo que un ___.", "truth": "delfín", "alsoTrue": ["delfin", "delfines"] },
  { "id": "pringles-burial", "question": "El inventor del bote de Pringles pidió que parte de sus cenizas se enterrasen en ___.", "truth": "un bote de Pringles", "alsoTrue": ["un tubo de pringles", "uno", "una lata de pringles", "un bote de pringles", "un pringles"] },
  { "id": "venus-day", "question": "Venus tarda más en ___ que en dar una vuelta completa al Sol.", "truth": "girar sobre sí mismo", "alsoTrue": ["girar sobre si mismo", "rotar", "girar", "dar una vuelta sobre sí mismo", "dar una vuelta sobre si mismo", "rotar sobre su eje", "girar sobre su eje", "dar un giro sobre su eje"] },
  { "id": "tittle", "question": "El puntito de la i minúscula tiene nombre: se llama ___.", "truth": "tilde", "alsoTrue": ["la tilde", "tittle"] },
  { "id": "peanut-legume", "question": "El cacahuete no es un fruto seco: es una ___.", "truth": "legumbre", "alsoTrue": ["una legumbre", "legumbres", "leguminosa", "una leguminosa"] },
  { "id": "sharks-trees", "question": "Los tiburones existen desde antes que ___.", "truth": "los árboles", "alsoTrue": ["los arboles", "árboles", "arboles"] },
  { "id": "twitter-larry", "question": "El pájaro del antiguo logotipo de Twitter tenía nombre: ___.", "truth": "Larry", "alsoTrue": ["larry the bird", "larry bird"] },
  { "id": "crow-faces", "question": "Los cuervos recuerdan y reconocen ___ humanas.", "truth": "caras", "alsoTrue": ["las caras", "rostros", "los rostros"] },
  { "id": "bubble-wallpaper", "question": "El plástico de burbujas se vendió primero como ___.", "truth": "papel pintado", "alsoTrue": ["papel de pared", "papel para paredes", "papel pintado con textura", "empapelado"] },
  { "id": "hiccups-68", "question": "El ataque de hipo más largo registrado duró ___ años.", "truth": "68", "alsoTrue": ["sesenta y ocho"] },
  { "id": "koala-prints", "question": "Las huellas dactilares de los koalas casi no se distinguen de las de ___.", "truth": "los humanos", "alsoTrue": ["las personas", "los seres humanos", "una persona", "un humano", "humanos", "nosotros"] },
  { "id": "whale-heart", "question": "El corazón de una ballena azul es del tamaño de ___.", "truth": "un coche pequeño", "alsoTrue": ["un coche", "un carro", "un auto", "un cochecito", "un coche de choque", "un carrito de golf"] },
  { "id": "trees-stars", "question": "En la Tierra hay más ___ que estrellas en la Vía Láctea.", "truth": "árboles", "alsoTrue": ["arboles", "arbol", "árbol"] },
  { "id": "jiffy-unit", "question": "En inglés, un \"jiffy\" es una unidad real de ___.", "truth": "tiempo", "alsoTrue": ["medida de tiempo"] },
  { "id": "apple-newton", "question": "El primer logotipo de Apple mostraba a ___ sentado bajo un árbol.", "truth": "Isaac Newton", "alsoTrue": ["newton", "sir isaac newton"] },
  { "id": "italian-tooth-mouse", "question": "En Francia, los dientes de leche no se los lleva el Ratoncito Pérez sino ___.", "truth": "un ratoncito", "alsoTrue": ["un ratón", "un raton", "el ratoncito", "la petite souris", "un pequeño ratón", "el ratón"] },
  { "id": "shortest-flight", "question": "El vuelo regular más corto del mundo, entre dos islas escocesas, dura alrededor de ___.", "truth": "90 segundos", "alsoTrue": ["minuto y medio", "un minuto y medio", "dos minutos", "2 minutos", "noventa segundos", "un minuto", "1 minuto"] },
  { "id": "cats-sweet", "question": "Los gatos no pueden saborear ___.", "truth": "el dulce", "alsoTrue": ["lo dulce", "dulce", "el azúcar", "el azucar", "las cosas dulces", "los dulces", "nada dulce"] },
  { "id": "dolphin-names", "question": "Los delfines tienen nombres para ___.", "truth": "los demás delfines", "alsoTrue": ["sí mismos", "si mismos", "ellos mismos", "otros delfines", "los otros delfines", "llamarse entre ellos", "cada uno", "unos a otros"] },
  { "id": "lightning-sun", "question": "Un rayo es unas cinco veces más caliente que la superficie del ___.", "truth": "Sol", "alsoTrue": ["el sol"] }
]
