[
  { "id": "zanzibar-war", "question": "The shortest war in history, between Britain and Zanzibar in 1896, was over in about ___.", "truth": "38 minutes", "alsoTrue": ["forty minutes", "40 minutes", "thirty-eight minutes", "under an hour", "less than an hour", "half an hour"] },
  { "id": "eiffel-summer", "question": "In summer the Eiffel Tower gets about ___ taller.", "truth": "15 centimetres", "alsoTrue": ["15 cm", "six inches", "6 inches", "fifteen centimetres", "15 centimeters"] },
  { "id": "octopus-hearts", "question": "An octopus has ___ hearts.", "truth": "three", "alsoTrue": ["3"] },
  { "id": "tomb-honey", "question": "Honey found in ancient Egyptian tombs was still ___.", "truth": "edible", "alsoTrue": ["good to eat", "fine to eat", "perfectly edible"] },
  { "id": "flamingo-group", "question": "A group of flamingos is called a ___.", "truth": "flamboyance", "alsoTrue": ["a flamboyance"] },
  { "id": "scotland-animal", "question": "The national animal of Scotland is the ___.", "truth": "unicorn", "alsoTrue": ["a unicorn"] },
  { "id": "banana-berry", "question": "To a botanist, a banana is a ___.", "truth": "berry", "alsoTrue": ["a berry", "berries"] },
  { "id": "swiss-guinea-pig", "question": "In Switzerland it is against the law to keep just one ___.", "truth": "guinea pig", "alsoTrue": ["guinea pigs", "a guinea pig"] },
  { "id": "nintendo-cards", "question": "Nintendo was founded in 1889 to make ___.", "truth": "playing cards", "alsoTrue": ["cards", "card games", "hanafuda cards", "hanafuda"] },
  { "id": "wooden-mouse", "question": "The first computer mouse was made of ___.", "truth": "wood", "alsoTrue": ["a block of wood", "pine wood"] },
  { "id": "astronaut-height", "question": "In space, astronauts grow about ___ taller.", "truth": "5 centimetres", "alsoTrue": ["5 cm", "two inches", "2 inches", "five centimetres", "5 centimeters"] },
  { "id": "wombat-cubes", "question": "Wombat droppings are shaped like ___.", "truth": "cubes", "alsoTrue": ["a cube", "little cubes", "dice", "squares"] },
  { "id": "oxford-aztec", "question": "The University of Oxford is older than the ___ Empire.", "truth": "Aztec", "alsoTrue": ["the aztec", "aztecs"] },
  { "id": "cleopatra-moon", "question": "Cleopatra lived closer in time to the Moon landing than to the building of the ___.", "truth": "Great Pyramid", "alsoTrue": ["pyramids", "the pyramids", "great pyramid of giza", "pyramid of giza", "pyramids of giza"] },
  { "id": "sloth-breath", "question": "A sloth can hold its breath longer than a ___.", "truth": "dolphin", "alsoTrue": ["dolphins"] },
  { "id": "pringles-burial", "question": "The man who designed the Pringles can had some of his ashes buried in ___.", "truth": "a Pringles can", "alsoTrue": ["a pringles tube", "one", "a can of pringles", "a pringles tin"] },
  { "id": "venus-day", "question": "Venus takes longer to ___ than to go once around the Sun.", "truth": "spin on its axis", "alsoTrue": ["rotate", "spin", "turn", "rotate once", "spin once", "turn once on its axis", "rotate on its axis"] },
  { "id": "tittle", "question": "The dot over a lower-case i is called a ___.", "truth": "tittle", "alsoTrue": ["a tittle"] },
  { "id": "peanut-legume", "question": "Peanuts are not nuts at all: they are ___.", "truth": "legumes", "alsoTrue": ["a legume", "beans", "in the bean family", "pulses"] },
  { "id": "sharks-trees", "question": "Sharks have been around longer than ___.", "truth": "trees", "alsoTrue": ["the trees"] },
  { "id": "twitter-larry", "question": "The bird in the old Twitter logo had a name: ___.", "truth": "Larry", "alsoTrue": ["larry the bird", "larry bird"] },
  { "id": "crow-faces", "question": "Crows can remember and recognise human ___.", "truth": "faces", "alsoTrue": ["a face", "your face"] },
  { "id": "bubble-wallpaper", "question": "Bubble wrap was first sold as ___.", "truth": "wallpaper", "alsoTrue": ["wall paper", "textured wallpaper", "3d wallpaper"] },
  { "id": "hiccups-68", "question": "The longest bout of hiccups on record went on for ___ years.", "truth": "68", "alsoTrue": ["sixty-eight", "sixty eight"] },
  { "id": "koala-prints", "question": "Koala fingerprints are almost impossible to tell apart from ___.", "truth": "human fingerprints", "alsoTrue": ["humans", "ours", "a human's", "people's", "human ones", "a person's"] },
  { "id": "whale-heart", "question": "A blue whale's heart is about the size of a ___.", "truth": "small car", "alsoTrue": ["car", "a car", "golf cart", "bumper car", "a small car"] },
  { "id": "trees-stars", "question": "There are more ___ on Earth than stars in the Milky Way.", "truth": "trees", "alsoTrue": ["tree"] },
  { "id": "jiffy-unit", "question": "A jiffy is a real unit of ___.", "truth": "time", "alsoTrue": ["measuring time"] },
  { "id": "apple-newton", "question": "Apple's very first logo showed ___ sitting under a tree.", "truth": "Isaac Newton", "alsoTrue": ["newton", "sir isaac newton"] },
  { "id": "spanish-tooth-mouse", "question": "In Spain, the tooth fairy is not a fairy but a ___.", "truth": "mouse", "alsoTrue": ["a mouse", "little mouse", "a little mouse", "rat", "ratoncito perez", "perez the mouse"] },
  { "id": "shortest-flight", "question": "The world's shortest scheduled flight, between two Scottish islands, takes about ___.", "truth": "90 seconds", "alsoTrue": ["a minute and a half", "one and a half minutes", "two minutes", "2 minutes", "ninety seconds", "one minute", "1 minute"] },
  { "id": "cats-sweet", "question": "Cats cannot taste ___.", "truth": "sweetness", "alsoTrue": ["sweet", "sweet things", "sugar", "sweet flavours", "anything sweet"] },
  { "id": "dolphin-names", "question": "Dolphins have names for ___.", "truth": "each other", "alsoTrue": ["one another", "themselves", "other dolphins"] },
  { "id": "lightning-sun", "question": "A bolt of lightning is about five times hotter than the surface of the ___.", "truth": "Sun", "alsoTrue": ["the sun"] }
]
